{
  "format": "cco-player-data",
  "formatVersion": 1,
  "exportedAt": "2026-08-30T00:00:00.000Z",
  "producer": {
    "app": "cco-toolkit",
    "appVersion": "0.1.0"
  },
  "sections": [
    {
      "id": "progression",
      "schemaVersion": 1,
      "data": {
        "levels": [
          { "id": "level", "value": 1 }
        ]
      }
    }
  ]
}
