{
  "format": "cco-player-data",
  "formatVersion": 1,
  "exportedAt": "2026-08-30T00:00:00.000Z",
  "producer": {
    "app": "future-toolkit",
    "appVersion": "2.0.0"
  },
  "sections": [
    {
      "id": "inventory",
      "schemaVersion": 2,
      "data": {
        "futureInventoryShape": true
      }
    }
  ]
}
